{
  "schema_version": "historical_source_manifest.v1",
  "dataset_id": "SYNTHETIC_GENERIC_MINIMAL_V1",
  "symbol": "SYNTH#", "timeframe": "H1",
  "boundary_start_timestamp": "2020-01-02T00:00:00",
  "boundary_end_timestamp": "2020-01-02T02:00:00",
  "broker_history_completeness": "NOT_PROVEN",
  "raw_broker_csv_committed": false,
  "sources": [{
    "schema_version": "source_file_descriptor.v1",
    "source_id": "SYNTH_MINIMAL_SOURCE",
    "file_name": "synthetic-minimal.tsv",
    "runtime_path": "relocated/minimal.tsv",
    "sha256": "6d554d1055aafd0e3fc727d7d520863da3f93498b216264b685aa2a15114bd47",
    "size_bytes": 149, "row_count": 3,
    "first_timestamp": "2020-01-02T00:00:00",
    "last_timestamp": "2020-01-02T02:00:00",
    "format": "MT5_TSV_OHLC_V1"
  }],
  "expected_timeline": {
    "source_count": 1, "total_rows": 3,
    "first_timestamp": "2020-01-02T00:00:00",
    "last_timestamp": "2020-01-02T02:00:00",
    "duplicate_timestamps": 0,
    "canonical_timeline_sha256": "a9ddc4ed4429c19b8d9336093075da7f76849ea30246a37d476aa4a43c8eca8e"
  }
}
